mysql> use teknowell;
Database changed

mysql> show tables;
+---------------------+
| Tables_in_teknowell |
+---------------------+
| puneitcompanies     |
| student             |
| studentcsvdemo      |
| subjects            |
+---------------------+
4 rows in set (0.05 sec)

mysql> create table employee (eid int primary key auto_increment, ename varchar(30), salary int, city varchar(20));
Query OK, 0 rows affected (0.07 sec)

mysql> select * table employee;
ERROR 1064 (42000): You have an error in your SQL syntax; check the manual that corresponds to your MySQL server version for the right syntax to use near 'table employee' at line 1
mysql> select * from employee;;
Empty set (0.00 sec)

ERROR:
No query specified

mysql> select * from employee;
Empty set (0.00 sec)

mysql> insert into employee values('Atharva',20000,'Pune');
ERROR 1136 (21S01): Column count doesn't match value count at row 1
mysql> insert into employee values(1,'Atharva',20000,'Pune');
Query OK, 1 row affected (0.01 sec)

mysql> select * from employee;
+-----+---------+--------+------+
| eid | ename   | salary | city |
+-----+---------+--------+------+
|   1 | Atharva |  20000 | Pune |
+-----+---------+--------+------+
1 row in set (0.00 sec)

mysql> insert into employee values(2,'Aditi',25000,'Pune'),(3,'Sanket',30000,'Banglore'),(4,'Prashant',35000,'Nagpur'),(5,'Shruti',40000,'Satara');
Query OK, 4 rows affected (0.01 sec)
Records: 4  Duplicates: 0  Warnings: 0

mysql> select * from employee;
+-----+----------+--------+----------+
| eid | ename    | salary | city     |
+-----+----------+--------+----------+
|   1 | Atharva  |  20000 | Pune     |
|   2 | Aditi    |  25000 | Pune     |
|   3 | Sanket   |  30000 | Banglore |
|   4 | Prashant |  35000 | Nagpur   |
|   5 | Shruti   |  40000 | Satara   |
+-----+----------+--------+----------+
5 rows in set (0.00 sec)

mysql> update employee set city='Nashik' where id=1;
ERROR 1054 (42S22): Unknown column 'id' in 'where clause'
mysql> update employee set city='Nashik' where id='1';
ERROR 1054 (42S22): Unknown column 'id' in 'where clause'
mysql> update table employee set city='Nashik' where id='1';
ERROR 1064 (42000): You have an error in your SQL syntax; check the manual that corresponds to your MySQL server version for the right syntax to use near 'table employee set city='Nashik' where id='1'' at line 1
mysql> update employee set city='Nashik' where id='1';
ERROR 1054 (42S22): Unknown column 'id' in 'where clause'
mysql> update employee set city='Nashik' where eid='1';
Query OK, 1 row affected (0.01 sec)
Rows matched: 1  Changed: 1  Warnings: 0

mysql> select * from employee;
+-----+----------+--------+----------+
| eid | ename    | salary | city     |
+-----+----------+--------+----------+
|   1 | Atharva  |  20000 | Nashik   |
|   2 | Aditi    |  25000 | Pune     |
|   3 | Sanket   |  30000 | Banglore |
|   4 | Prashant |  35000 | Nagpur   |
|   5 | Shruti   |  40000 | Satara   |
+-----+----------+--------+----------+
5 rows in set (0.00 sec)

mysql> select * from employee where eid=1;
+-----+---------+--------+--------+
| eid | ename   | salary | city   |
+-----+---------+--------+--------+
|   1 | Atharva |  20000 | Nashik |
+-----+---------+--------+--------+
1 row in set (0.00 sec)



------------------------------------------------------------------------------------------------------------------------------------------------------------

Q.1 Display details of those whose name is 'Aditi'

mysql> select * from employee where ename='Aditi';
+-----+-------+--------+------+
| eid | ename | salary | city |
+-----+-------+--------+------+
|   2 | Aditi |  25000 | Pune |
+-----+-------+--------+------+
1 row in set (0.00 sec)

mysql> alter table employee rename column eid to id;
Query OK, 0 rows affected (0.03 sec)
Records: 0  Duplicates: 0  Warnings: 0

mysql> alter table employee rename column ename to name;
Query OK, 0 rows affected (0.03 sec)
Records: 0  Duplicates: 0  Warnings: 0

mysql> select * from employee;
+----+----------+--------+----------+
| id | name     | salary | city     |
+----+----------+--------+----------+
|  1 | Atharva  |  20000 | Nashik   |
|  2 | Aditi    |  25000 | Pune     |
|  3 | Sanket   |  30000 | Banglore |
|  4 | Prashant |  35000 | Nagpur   |
|  5 | Shruti   |  40000 | Satara   |
+----+----------+--------+----------+
5 rows in set (0.00 sec)

mysql> select * from employee where name='Aditi';
+----+-------+--------+------+
| id | name  | salary | city |
+----+-------+--------+------+
|  2 | Aditi |  25000 | Pune |
+----+-------+--------+------+
1 row in set (0.00 sec)

mysql> insert into employee (name,salary,city) values('Shweta',60000,'Agra'),('Chaitanya',55000,'Chinchwad'),('Vishwajeet',50000,'Satara');
Query OK, 3 rows affected (0.01 sec)
Records: 3  Duplicates: 0  Warnings: 0

mysql> select * from employee;
+----+------------+--------+-----------+
| id | name       | salary | city      |
+----+------------+--------+-----------+
|  1 | Atharva    |  20000 | Nashik    |
|  2 | Aditi      |  25000 | Pune      |
|  3 | Sanket     |  30000 | Banglore  |
|  4 | Prashant   |  35000 | Nagpur    |
|  5 | Shruti     |  40000 | Satara    |
|  6 | Shweta     |  60000 | Agra      |
|  7 | Chaitanya  |  55000 | Chinchwad |
|  8 | Vishwajeet |  50000 | Satara    |
+----+------------+--------+-----------+
8 rows in set (0.00 sec)

mysql> alter table employee drop auto_increment;
ERROR 1091 (42000): Can't DROP 'auto_increment'; check that column/key exists
mysql> alter table employee drop auto_increment(id);
ERROR 1064 (42000): You have an error in your SQL syntax; check the manual that corresponds to your MySQL server version for the right syntax to use near '(id)' at line 1
mysql> alter table employee drop primary key;
ERROR 1075 (42000): Incorrect table definition; there can be only one auto column and it must be defined as a key
mysql> alter table employee modify id int;
Query OK, 8 rows affected (0.09 sec)
Records: 8  Duplicates: 0  Warnings: 0

mysql> desc employee;
+--------+-------------+------+-----+---------+-------+
| Field  | Type        | Null | Key | Default | Extra |
+--------+-------------+------+-----+---------+-------+
| id     | int         | NO   | PRI | NULL    |       |
| name   | varchar(30) | YES  |     | NULL    |       |
| salary | int         | YES  |     | NULL    |       |
| city   | varchar(20) | YES  |     | NULL    |       |
+--------+-------------+------+-----+---------+-------+
4 rows in set (0.01 sec)

mysql> alter table employee drop primary key;
Query OK, 8 rows affected (0.10 sec)
Records: 8  Duplicates: 0  Warnings: 0

mysql> desc employee;
+--------+-------------+------+-----+---------+-------+
| Field  | Type        | Null | Key | Default | Extra |
+--------+-------------+------+-----+---------+-------+
| id     | int         | NO   |     | NULL    |       |
| name   | varchar(30) | YES  |     | NULL    |       |
| salary | int         | YES  |     | NULL    |       |
| city   | varchar(20) | YES  |     | NULL    |       |
+--------+-------------+------+-----+---------+-------+
4 rows in set (0.00 sec)

mysql> select * from employee;
+----+------------+--------+-----------+
| id | name       | salary | city      |
+----+------------+--------+-----------+
|  1 | Atharva    |  20000 | Nashik    |
|  2 | Aditi      |  25000 | Pune      |
|  3 | Sanket     |  30000 | Banglore  |
|  4 | Prashant   |  35000 | Nagpur    |
|  5 | Shruti     |  40000 | Satara    |
|  6 | Shweta     |  60000 | Agra      |
|  7 | Chaitanya  |  55000 | Chinchwad |
|  8 | Vishwajeet |  50000 | Satara    |
+----+------------+--------+-----------+
8 rows in set (0.00 sec)

mysql> alter table employee add primary key(id);
Query OK, 0 rows affected (0.11 sec)
Records: 0  Duplicates: 0  Warnings: 0

mysql> select * from employee;
+----+------------+--------+-----------+
| id | name       | salary | city      |
+----+------------+--------+-----------+
|  1 | Atharva    |  20000 | Nashik    |
|  2 | Aditi      |  25000 | Pune      |
|  3 | Sanket     |  30000 | Banglore  |
|  4 | Prashant   |  35000 | Nagpur    |
|  5 | Shruti     |  40000 | Satara    |
|  6 | Shweta     |  60000 | Agra      |
|  7 | Chaitanya  |  55000 | Chinchwad |
|  8 | Vishwajeet |  50000 | Satara    |
+----+------------+--------+-----------+
8 rows in set (0.00 sec)

mysql> desc employee;
+--------+-------------+------+-----+---------+-------+
| Field  | Type        | Null | Key | Default | Extra |
+--------+-------------+------+-----+---------+-------+
| id     | int         | NO   | PRI | NULL    |       |
| name   | varchar(30) | YES  |     | NULL    |       |
| salary | int         | YES  |     | NULL    |       |
| city   | varchar(20) | YES  |     | NULL    |       |
+--------+-------------+------+-----+---------+-------+
4 rows in set (0.00 sec)

mysql> insert into employee (name,salary,city) values('Karan',45000,'Mumbai');
ERROR 1364 (HY000): Field 'id' doesn't have a default value
mysql> insert into employee values('Null''Karan',45000,'Mumbai');
ERROR 1136 (21S01): Column count doesn't match value count at row 1
mysql> insert into employee values('''Karan',45000,'Mumbai');
ERROR 1136 (21S01): Column count doesn't match value count at row 1
mysql> insert into employee values('Null','Karan',45000,'Mumbai');
ERROR 1366 (HY000): Incorrect integer value: 'Null' for column 'id' at row 1
mysql> insert into employee values('','Karan',45000,'Mumbai');
ERROR 1366 (HY000): Incorrect integer value: '' for column 'id' at row 1
mysql> insert into employee values('1','Karan',45000,'Mumbai');
ERROR 1062 (23000): Duplicate entry '1' for key 'employee.PRIMARY'
mysql> insert into employee values('9','Karan',45000,'Mumbai');
Query OK, 1 row affected (0.01 sec)

mysql> select * from employee;
+----+------------+--------+-----------+
| id | name       | salary | city      |
+----+------------+--------+-----------+
|  1 | Atharva    |  20000 | Nashik    |
|  2 | Aditi      |  25000 | Pune      |
|  3 | Sanket     |  30000 | Banglore  |
|  4 | Prashant   |  35000 | Nagpur    |
|  5 | Shruti     |  40000 | Satara    |
|  6 | Shweta     |  60000 | Agra      |
|  7 | Chaitanya  |  55000 | Chinchwad |
|  8 | Vishwajeet |  50000 | Satara    |
|  9 | Karan      |  45000 | Mumbai    |
+----+------------+--------+-----------+
9 rows in set (0.00 sec)

mysql> select * from employee where salary>45000;
+----+------------+--------+-----------+
| id | name       | salary | city      |
+----+------------+--------+-----------+
|  6 | Shweta     |  60000 | Agra      |
|  7 | Chaitanya  |  55000 | Chinchwad |
|  8 | Vishwajeet |  50000 | Satara    |
+----+------------+--------+-----------+
3 rows in set (0.00 sec)

mysql> select * from employee where salary>45000 asc;
ERROR 1064 (42000): You have an error in your SQL syntax; check the manual that corresponds to your MySQL server version for the right syntax to use near 'asc' at line 1
mysql> select * from employee order by id desc where salary>45000 asc;
ERROR 1064 (42000): You have an error in your SQL syntax; check the manual that corresponds to your MySQL server version for the right syntax to use near 'where salary>45000 asc' at line 1
mysql> select * from employee order by id desc where salary>45000;
ERROR 1064 (42000): You have an error in your SQL syntax; check the manual that corresponds to your MySQL server version for the right syntax to use near 'where salary>45000' at line 1
mysql> select * from employee where salary>45000 order by id desc;
+----+------------+--------+-----------+
| id | name       | salary | city      |
+----+------------+--------+-----------+
|  8 | Vishwajeet |  50000 | Satara    |
|  7 | Chaitanya  |  55000 | Chinchwad |
|  6 | Shweta     |  60000 | Agra      |
+----+------------+--------+-----------+
3 rows in set (0.00 sec)

------------------------------------------------------------------------------------------------------------------------------------------------------------


Q.2. Display details of those whose salary > 45000 

mysql> select * from employee where salary>45000 order by salary ;
+----+------------+--------+-----------+
| id | name       | salary | city      |
+----+------------+--------+-----------+
|  8 | Vishwajeet |  50000 | Satara    |
|  7 | Chaitanya  |  55000 | Chinchwad |
|  6 | Shweta     |  60000 | Agra      |
+----+------------+--------+-----------+
3 rows in set (0.00 sec)

------------------------------------------------------------------------------------------------------------------------------------------------------------

Q.3.  Display name of those employee whose salary is 40000
mysql> select name from employee where salary=40000;
+--------+
| name   |
+--------+
| Shruti |
+--------+
1 row in set (0.00 sec)

------------------------------------------------------------------------------------------------------------------------------------------------------------

Q.4. Display name of those whose city is 'pune'

 mysql> select NAME from employee where city='PUNE';
+-------+
| NAME  |
+-------+
| Aditi |
+-------+
1 row in set (0.00 sec)

------------------------------------------------------------------------------------------------------------------------------------------------------------

Q.5. Display details of those whose city is 'pune' and 'nashik'

mysql> select * from employee where city='pune' or city='Nashik';
+----+---------+--------+--------+
| id | name    | salary | city   |
+----+---------+--------+--------+
|  1 | Atharva |  20000 | Nashik |
|  2 | Aditi   |  25000 | Pune   |
+----+---------+--------+--------+
2 rows in set (0.00 sec)

------------------------------------------------------------------------------------------------------------------------------------------------------------

Q.6. display details of those employee which are not belong to'pune'.

mysql> select * from employee where city!='PUNE' ;
+----+------------+--------+-----------+
| id | name       | salary | city      |
+----+------------+--------+-----------+
|  1 | Atharva    |  20000 | Nashik    |
|  3 | Sanket     |  30000 | Banglore  |
|  4 | Prashant   |  35000 | Nagpur    |
|  5 | Shruti     |  40000 | Satara    |
|  6 | Shweta     |  60000 | Agra      |
|  7 | Chaitanya  |  55000 | Chinchwad |
|  8 | Vishwajeet |  50000 | Satara    |
|  9 | Karan      |  45000 | Mumbai    |
+----+------------+--------+-----------+
8 rows in set (0.00 sec)

------------------------------------------------------------------------------------------------------------------------------------------------------------

Q.7. Display details of those whose city name starts with 'p'

mysql> select * from employee where city like 'p%';
+----+-------+--------+------+
| id | name  | salary | city |
+----+-------+--------+------+
|  2 | Aditi |  25000 | Pune |
+----+-------+--------+------+
1 row in set (0.00 sec)

-----------------------------------------------------------------------------------------------------------------------------------------------------------

Q.8. Display details of those whose name ends with 'a'

mysql> select * from employee where name like '%a';
+----+-----------+--------+-----------+
| id | name      | salary | city      |
+----+-----------+--------+-----------+
|  1 | Atharva   |  20000 | Nashik    |
|  6 | Shweta    |  60000 | Agra      |
|  7 | Chaitanya |  55000 | Chinchwad |
+----+-----------+--------+-----------+
3 rows in set (0.00 sec)

------------------------------------------------------------------------------------------------------------------------------------------------------------

Q.9. Display details of those whose names second letter is 'i'

mysql> select * from employee where name like '_i%';
+----+------------+--------+--------+
| id | name       | salary | city   |
+----+------------+--------+--------+
|  8 | Vishwajeet |  50000 | Satara |
+----+------------+--------+--------+
1 row in set (0.00 sec)
------------------------------------------------------------------------------------------------------------------------------------------------------------

Q.10. Display details of those whose second last letter is 'a' 

mysql> select * from employee where name like '%a_' or city like '%a_';
+----+-----------+--------+-----------+
| id | name      | salary | city      |
+----+-----------+--------+-----------+
|  7 | Chaitanya |  55000 | Chinchwad |
|  9 | Karan     |  45000 | Mumbai    |
+----+-----------+--------+-----------+
2 rows in set, 9 warnings (0.00 sec)

------------------------------------------------------------------------------------------------------------------------------------------------------------

Q.11. Display details of those which contains 'sh'.


mysql> select * from employee where name like '%sh%' or city like '%sh%';
+----+------------+--------+--------+
| id | name       | salary | city   |
+----+------------+--------+--------+
|  1 | Atharva    |  20000 | Nashik |
|  4 | Prashant   |  35000 | Nagpur |
|  5 | Shruti     |  40000 | Satara |
|  6 | Shweta     |  60000 | Agra   |
|  8 | Vishwajeet |  50000 | Satara |
+----+------------+--------+--------+
5 rows in set (0.00 sec)


------------------------------------------------------------------------------------------------------------------------------------------------------------

Q.12. Display details of those whose salary is between 20000 and 50000.

mysql> select * from employee where salary between 20000 and 50000;
+----+------------+--------+----------+
| id | name       | salary | city     |
+----+------------+--------+----------+
|  1 | Atharva    |  20000 | Nashik   |
|  2 | Aditi      |  25000 | Pune     |
|  3 | Sanket     |  30000 | Banglore |
|  4 | Prashant   |  35000 | Nagpur   |
|  5 | Shruti     |  40000 | Satara   |
|  8 | Vishwajeet |  50000 | Satara   |
|  9 | Karan      |  45000 | Mumbai   |
+----+------------+--------+----------+
7 rows in set (0.00 sec)

------------------------------------------------------------------------------------------------------------------------------------------------------------

Q.13. Find out details of those whose salary less than 50000 

mysql> select * from employee where salary < 50000;
+----+----------+--------+----------+
| id | name     | salary | city     |
+----+----------+--------+----------+
|  1 | Atharva  |  20000 | Nashik   |
|  2 | Aditi    |  25000 | Pune     |
|  3 | Sanket   |  30000 | Banglore |
|  4 | Prashant |  35000 | Nagpur   |
|  5 | Shruti   |  40000 | Satara   |
|  9 | Karan    |  45000 | Mumbai   |
+----+----------+--------+----------+
6 rows in set (0.00 sec)

------------------------------------------------------------------------------------------------------------------------------------------------------------

Q.14. Display city of 'sanket' and 'chaitanya' 			"IN" used

mysql> select city from employee where name in ("Sanket" ,"Chaitanya");
+-----------+
| city      |
+-----------+
| Banglore  |
| Chinchwad |
+-----------+
2 rows in set (0.00 sec)

------------------------------------------------------------------------------------------------------------------------------------------------------------

Q.15. Display details of those whose city is 'pune' and salary>30000.


mysql> select * from employee where city='Pune' and salary>30000;
Empty set (0.00 sec)

mysql> select * from employee where city='Pune' and salary>20000;
+----+-------+--------+------+
| id | name  | salary | city |
+----+-------+--------+------+
|  2 | Aditi |  25000 | Pune |
+----+-------+--------+------+
1 row in set (0.00 sec)


------------------------------------------------------------------------------------------------------------------------------------------------------------


Q.16. Display details of those employees whose name starts with ‘a’,’s’ and ‘j’

mysql> select * from employee where name like 'a%' or name like 's%' or name like 'j%';
+----+---------+--------+----------+
| id | name    | salary | city     |
+----+---------+--------+----------+
|  1 | Atharva |  20000 | Nashik   |
|  2 | Aditi   |  25000 | Pune     |
|  3 | Sanket  |  30000 | Banglore |
|  5 | Shruti  |  40000 | Satara   |
|  6 | Shweta  |  60000 | Agra     |
+----+---------+--------+----------+
5 rows in set (0.00 sec)

Using REFEXP -

1. Starting Search 
mysql> select * from employee where name regexp '^[asj]';
+----+---------+--------+----------+
| id | name    | salary | city     |
+----+---------+--------+----------+
|  1 | Atharva |  20000 | Nashik   |
|  2 | Aditi   |  25000 | Pune     |
|  3 | Sanket  |  30000 | Banglore |
|  5 | Shruti  |  40000 | Satara   |
|  6 | Shweta  |  60000 | Agra     |
+----+---------+--------+----------+
5 rows in set (0.03 sec)

2. Ending Search 
mysql> select * from employee where name regexp '[asj]$';
+----+-----------+--------+-----------+
| id | name      | salary | city      |
+----+-----------+--------+-----------+
|  1 | Atharva   |  20000 | Nashik    |
|  6 | Shweta    |  60000 | Agra      |
|  7 | Chaitanya |  55000 | Chinchwad |
+----+-----------+--------+-----------+
3 rows in set (0.00 sec)

3. Both Starting OR Ending
mysql> select * from employee where name regexp '^[asj]' or name regexp '[asj]$';
+----+-----------+--------+-----------+
| id | name      | salary | city      |
+----+-----------+--------+-----------+
|  1 | Atharva   |  20000 | Nashik    |
|  2 | Aditi     |  25000 | Pune      |	
|  3 | Sanket    |  30000 | Banglore  |
|  5 | Shruti    |  40000 | Satara    |
|  6 | Shweta    |  60000 | Agra      |
|  7 | Chaitanya |  55000 | Chinchwad |
+----+-----------+--------+-----------+
6 rows in set (0.00 sec)

4. Both Starting AND Ending

^ → start of the string
[asj] → first letter can be a, s, or j
.* → zero or more characters in between
[asj]$ → last letter can be a, s, or j

mysql> select * from employee where name regexp '^[asj].*[asj]$';
+----+---------+--------+--------+
| id | name    | salary | city   |
+----+---------+--------+--------+
|  1 | Atharva |  20000 | Nashik |
|  6 | Shweta  |  60000 | Agra   |
+----+---------+--------+--------+
2 rows in set (0.00 sec)